{
  "id": "PG_20240603_002",
  "date": "2024-06-03",
  "vendor": {
    "name": "Kalyan Jewellers",
    "branch": "Anna Nagar, Chennai",
    "billNumber": "KLN/CHN/AN/24/5678",
    "gstin": "33AABCK5678M1ZP"
  },
  "items": [
    {
      "type": "coin",
      "description": "24K Gold Coin - Lakshmi Design",
      "weight": {
        "gross": 10.0,
        "net": 10.0,
        "stone": 0
      },
      "purity": {
        "karat": 24,
        "fineness": 999
      },
      "rate": 7200,
      "goldValue": 72000,
      "makingCharge": {
        "amount": 500,
        "type": "flat"
      },
      "wastage": {
        "percentage": 0,
        "amount": 0
      },
      "stoneCharges": 0,
      "otherCharges": 100
    }
  ],
  "totalAmount": {
    "subtotal": 72600,
    "gst": {
      "cgst": 1089,
      "sgst": 1089,
      "total": 2178
    },
    "roundOff": -0.78,
    "finalAmount": 74777
  },
  "paymentMethod": "upi",
  "billImage": "/storage/bills/kalyan_20240603.jpg",
  "extractedBy": "manual",
  "notes": "Investment purpose"
}
